{"blocker":{"details":"IH was derived canonically for /Users/spensermcconnell/.substrate as spensermcconnell/501. The exact attached source mirror, task checkout, and live origin ref equal 1126b907df6e38043e9071da222f6c6a377b341c / 3a29fa323a8b9099d894c11d98cc085ecf4807c5. The fixed root-owned Lima 2.1.1 image, durable host sudo, prefix ownership/mode, and canonical instance absence all passed. The guest executor now builds as AArch64 Linux ELF with the exact prepared Zig wrapper and the host control/executor build and ad-hoc code signing completed in the nonce-scoped external root. The required canonical dev installer has no CARGO_TARGET_DIR or external artifact input and hard-requires REPO_ROOT/target/<profile>; that target is absent in the source mirror. Writing it would violate the external-build/byte-clean mirror fence, while copying or altering the installer would be an ad hoc substitute. No Stage-1, PM derivation, Lima instance, guest sudo, LaunchDaemon, System Keychain, publisher, pairing, lifecycle, intent, retirement, or product mutation ran. Final parity confirms the prefix inventory, sudoers sentinel, fixed Lima digest, canonical instance absence, publisher component absence, task/mirror cleanliness, and remote equality.","handoff_prompt":"Repair and publish the canonical macOS dev installer so an explicitly declared external Cargo/build root can be consumed for every post-build lookup and staging path, or explicitly amend the evidence contract to permit the installer-owned mirror target directory. Bind a fresh evidence dispatch to the published source, preserve the exact fixed Lima and sudoers sentinels, and restart from a new pre-mutation baseline. Do not reuse this blocked artifact as native lifecycle proof.","required_authority":"A reviewed, remotely published source correction or an explicit contract amendment that resolves the canonical-installer external-build-root contradiction, followed by a fresh nonce-bound EVIDENCE:R3-MAC-IMP-01 dispatch.","summary":"Required canonical installer cannot consume the required external build outputs without prohibited attached-mirror mutation or an ad hoc installer substitute."},"checkout_unchanged":true,"dispatch_nonce":"c75137fee9e57e4a28ce730956b670c4c625330463a7c85b35d4b87605521f13","environment":{"host_id":"local","os_version":"macOS 15.7.7 (24G720), Darwin 24.6.0 arm64","project_id":"local-b2016f8a311fef93149e42eaec4d704d","project_path":"/Users/spensermcconnell/__Active_Code/atomize-hq/substrate","tool_versions":{"cargo":"1.89.0 (c24e10642 2025-06-23)","limactl":"2.1.1","python3":"3.11.9","rustc":"1.89.0 (29483883e 2025-08-04)","zig":"0.16.0"}},"evidence":{"artifact_path":"/Users/spensermcconnell/.codex/evidence/substrate-a1-1d-5r3-mac-20260806-41f97e1c570d/EVIDENCE-R3-MAC-IMP-01/c75137fee9e57e4a28ce730956b670c4c625330463a7c85b35d4b87605521f13/artifacts/r3-mac-imp-01-native-evidence.json","artifact_sha256":"sha256:aa00a6934f0ee73f1cc3633cc978909a11bdccab242c60bcefb111afb0051ace","gates":["AARCH64_GUEST_EXECUTOR_BUILD_PASSED","CANONICAL_INSTALLER_EXTERNAL_OUTPUT_BLOCKER","CHECKOUT_AND_MIRROR_CLEAN","HOST_BUILD_AND_CODESIGN_PASSED","HOST_RESTORATION_PARITY_PASSED","IH_CANONICALLY_DERIVED","SOURCE_REMOTE_EQUAL"]},"evidence_id":"EVIDENCE:R3-MAC-IMP-01","evidence_task":{"host_id":"local","thread_id":"019fe162-c98c-7c82-94d0-155d6cab5122"},"orchestration_id":"substrate-a1-1d-5r3-mac-20260806-41f97e1c570d","platform":"macos","prohibited_actions_confirmed":true,"protocol":"codex.top-level-evidence-receipt.v1","source":{"commit":"1126b907df6e38043e9071da222f6c6a377b341c","live_remote":"1126b907df6e38043e9071da222f6c6a377b341c","publication_mode":"remote","target_ref":"refs/heads/feat/internal-host-orchestrator-world-dispatch-bootstrap","tree":"3a29fa323a8b9099d894c11d98cc085ecf4807c5"},"status":"BLOCKED_PLATFORM_HANDOFF_REQUIRED"}
